{
  "scenario_id": "demo_scenario_gangnam_6m",
  "baseline_date": "2025-06-28",
  "horizon_months": 6,
  "data_version": "demo_v2025.06.28",
  "cache_status": "VERIFIED_SNAPSHOT_CACHE",
  "data_status": "DEMO_INCOMPLETE",
  "model_status": "SYNTHETIC_FIXTURE",
  "model_version": "synthetic-0.1.0",
  "is_investment_advice": false,
  "trust_dimensions": {
    "policy_completeness": "DEMO_INCOMPLETE",
    "data_completeness": "DEMO_INCOMPLETE",
    "evidence_fitness": "PARTIAL",
    "model_reproducibility": "SYNTHETIC_FIXTURE"
  },
  "summary": "인터페이스 검증용 합성 시나리오입니다. 강남구, 서초구, 송파구 등 직접 규제 지역은 주담대 6억 원 상한과 토지거래허가 실거주 의무가 결합되어 단기 거래량이 먼저 위축되고 매매가격 하방 압력이 나타나며, 성동구, 마포구, 분당구, 과천시 등 인접 비규제 대체지와 노원구 등 정책대출 적격 권역으로 수요 일부가 전이되는 조건부 경로를 보여줍니다.",
  "regions": [
    {
      "region_code": "11680",
      "region_name": "서울 강남구",
      "price_change": {
        "low": -2.1,
        "median": -1.4,
        "high": -0.7,
        "ci80_low": -2.6,
        "ci80_high": -0.3,
        "unit": "percent_vs_demo_baseline"
      },
      "transaction_change": {
        "low": -22.0,
        "median": -15.5,
        "high": -9.0,
        "ci80_low": -28.0,
        "ci80_high": -6.0,
        "unit": "percent_vs_demo_baseline"
      },
      "mortgage_limit_change": {
        "low": -38.0,
        "median": -31.0,
        "high": -24.0,
        "ci80_low": -42.0,
        "ci80_high": -18.0,
        "unit": "percent_vs_demo_baseline"
      },
      "confidence": "low",
      "effect_type": "direct",
      "primary_mechanism": "주담대 6억 상한 및 토지거래허가 2년 실거주 결합",
      "driving_rule_ids": [
        "demo_rule_mortgage_cap",
        "demo_rule_land_permit",
        "demo_rule_stress_dsr_phase3"
      ],
      "supporting_claim_ids": [
        "CL-KDI23-LTP-VOLUME-DIRECT",
        "CL-KDI23-LTP-PRICE-DIRECT",
        "CL-BOK16-DTI-PRICE-TIGHTEN",
        "CL-KDI22-LTV-PRICE-LONGRUN"
      ],
      "related_cohort_ids": [
        "demo_cohort_high_dsr",
        "demo_cohort_one_home_mover",
        "demo_cohort_cash_rich"
      ],
      "spillover_from_region_codes": []
    },
    {
      "region_code": "11650",
      "region_name": "서울 서초구",
      "price_change": {
        "low": -1.9,
        "median": -1.2,
        "high": -0.5,
        "ci80_low": -2.4,
        "ci80_high": -0.2,
        "unit": "percent_vs_demo_baseline"
      },
      "transaction_change": {
        "low": -20.5,
        "median": -14.0,
        "high": -8.0,
        "ci80_low": -25.0,
        "ci80_high": -5.0,
        "unit": "percent_vs_demo_baseline"
      },
      "mortgage_limit_change": {
        "low": -36.0,
        "median": -29.5,
        "high": -22.0,
        "ci80_low": -40.0,
        "ci80_high": -17.0,
        "unit": "percent_vs_demo_baseline"
      },
      "confidence": "low",
      "effect_type": "direct",
      "primary_mechanism": "고가주택 주담대 상한 및 실거주 의무 직접 적용",
      "driving_rule_ids": [
        "demo_rule_mortgage_cap",
        "demo_rule_land_permit",
        "demo_rule_stress_dsr_phase3"
      ],
      "supporting_claim_ids": [
        "CL-KDI23-LTP-VOLUME-DIRECT",
        "CL-KDI23-LTP-PRICE-DIRECT",
        "CL-BOK16-DTI-PRICE-TIGHTEN"
      ],
      "related_cohort_ids": [
        "demo_cohort_high_dsr",
        "demo_cohort_one_home_mover",
        "demo_cohort_cash_rich"
      ],
      "spillover_from_region_codes": []
    },
    {
      "region_code": "11710",
      "region_name": "서울 송파구",
      "price_change": {
        "low": -1.6,
        "median": -1.0,
        "high": -0.3,
        "ci80_low": -2.1,
        "ci80_high": 0.1,
        "unit": "percent_vs_demo_baseline"
      },
      "transaction_change": {
        "low": -18.5,
        "median": -12.8,
        "high": -7.2,
        "ci80_low": -23.0,
        "ci80_high": -4.5,
        "unit": "percent_vs_demo_baseline"
      },
      "mortgage_limit_change": {
        "low": -32.0,
        "median": -25.5,
        "high": -19.0,
        "ci80_low": -36.0,
        "ci80_high": -15.0,
        "unit": "percent_vs_demo_baseline"
      },
      "confidence": "low",
      "effect_type": "direct",
      "primary_mechanism": "토지거래허가 실거주 제약 및 갈아타기 처분 기한 단축",
      "driving_rule_ids": [
        "demo_rule_mortgage_cap",
        "demo_rule_land_permit",
        "demo_rule_one_home_disposal_deadline"
      ],
      "supporting_claim_ids": [
        "CL-KDI23-LTP-VOLUME-DIRECT",
        "CL-KDI23-LTP-PRICE-DIRECT",
        "CL-BOK25-MPP-PREEMPTIVE-LOAN"
      ],
      "related_cohort_ids": [
        "demo_cohort_high_dsr",
        "demo_cohort_one_home_mover"
      ],
      "spillover_from_region_codes": []
    },
    {
      "region_code": "11200",
      "region_name": "서울 성동구",
      "price_change": {
        "low": 0.3,
        "median": 0.8,
        "high": 1.4,
        "ci80_low": -0.1,
        "ci80_high": 1.8,
        "unit": "percent_vs_demo_baseline"
      },
      "transaction_change": {
        "low": 1.5,
        "median": 4.8,
        "high": 8.2,
        "ci80_low": -1.0,
        "ci80_high": 11.0,
        "unit": "percent_vs_demo_baseline"
      },
      "mortgage_limit_change": {
        "low": -21.0,
        "median": -16.0,
        "high": -11.0,
        "ci80_low": -25.0,
        "ci80_high": -8.0,
        "unit": "percent_vs_demo_baseline"
      },
      "confidence": "low",
      "effect_type": "spillover",
      "primary_mechanism": "토지거래허가 비지정 인접 권역으로의 매수 및 갭투자 대체 이동",
      "driving_rule_ids": [
        "demo_rule_land_permit",
        "demo_rule_mortgage_cap"
      ],
      "supporting_claim_ids": [
        "CL-KDI23-LTP-PRICE-SPILLOVER",
        "CL-BOK25HH-LEAKAGE"
      ],
      "related_cohort_ids": [
        "demo_cohort_one_home_mover",
        "demo_cohort_cash_rich"
      ],
      "spillover_from_region_codes": ["11680", "11650"]
    },
    {
      "region_code": "11440",
      "region_name": "서울 마포구",
      "price_change": {
        "low": 0.2,
        "median": 0.7,
        "high": 1.2,
        "ci80_low": -0.2,
        "ci80_high": 1.6,
        "unit": "percent_vs_demo_baseline"
      },
      "transaction_change": {
        "low": 1.0,
        "median": 4.2,
        "high": 7.5,
        "ci80_low": -1.5,
        "ci80_high": 10.0,
        "unit": "percent_vs_demo_baseline"
      },
      "mortgage_limit_change": {
        "low": -19.0,
        "median": -14.5,
        "high": -10.0,
        "ci80_low": -23.0,
        "ci80_high": -7.0,
        "unit": "percent_vs_demo_baseline"
      },
      "confidence": "low",
      "effect_type": "spillover",
      "primary_mechanism": "도심 직주근접 대체지 풍선효과 및 갈아타기 수요 유입",
      "driving_rule_ids": [
        "demo_rule_land_permit",
        "demo_rule_one_home_disposal_deadline"
      ],
      "supporting_claim_ids": [
        "CL-KDI23-LTP-PRICE-SPILLOVER",
        "CL-BOK25HH-MPP-HETEROGENEITY"
      ],
      "related_cohort_ids": [
        "demo_cohort_one_home_mover",
        "demo_cohort_cash_rich"
      ],
      "spillover_from_region_codes": ["11680", "11650"]
    },
    {
      "region_code": "11740",
      "region_name": "서울 강동구",
      "price_change": {
        "low": 0.2,
        "median": 0.6,
        "high": 1.1,
        "ci80_low": -0.2,
        "ci80_high": 1.5,
        "unit": "percent_vs_demo_baseline"
      },
      "transaction_change": {
        "low": 0.8,
        "median": 3.9,
        "high": 6.8,
        "ci80_low": -1.8,
        "ci80_high": 9.2,
        "unit": "percent_vs_demo_baseline"
      },
      "mortgage_limit_change": {
        "low": -17.0,
        "median": -13.0,
        "high": -9.0,
        "ci80_low": -20.0,
        "ci80_high": -6.0,
        "unit": "percent_vs_demo_baseline"
      },
      "confidence": "low",
      "effect_type": "spillover",
      "primary_mechanism": "송파구 인접 비허가구역 대체 매수 및 6억 한도 내 차입 이동",
      "driving_rule_ids": [
        "demo_rule_land_permit",
        "demo_rule_mortgage_cap"
      ],
      "supporting_claim_ids": [
        "CL-KDI23-LTP-PRICE-SPILLOVER",
        "CL-BOK25HH-LEAKAGE"
      ],
      "related_cohort_ids": [
        "demo_cohort_one_home_mover",
        "demo_cohort_high_dsr"
      ],
      "spillover_from_region_codes": ["11710"]
    },
    {
      "region_code": "41135",
      "region_name": "경기 성남시 분당구",
      "price_change": {
        "low": 0.1,
        "median": 0.5,
        "high": 1.0,
        "ci80_low": -0.3,
        "ci80_high": 1.4,
        "unit": "percent_vs_demo_baseline"
      },
      "transaction_change": {
        "low": -1.5,
        "median": 2.4,
        "high": 5.8,
        "ci80_low": -4.0,
        "ci80_high": 8.0,
        "unit": "percent_vs_demo_baseline"
      },
      "mortgage_limit_change": {
        "low": -24.0,
        "median": -18.5,
        "high": -13.0,
        "ci80_low": -28.0,
        "ci80_high": -10.0,
        "unit": "percent_vs_demo_baseline"
      },
      "confidence": "low",
      "effect_type": "spillover",
      "primary_mechanism": "강남권 토지거래허가 회피 수요 유입과 주담대 6억 상한의 상충",
      "driving_rule_ids": [
        "demo_rule_land_permit",
        "demo_rule_mortgage_cap",
        "demo_rule_stress_dsr_phase3"
      ],
      "supporting_claim_ids": [
        "CL-KDI23-LTP-PRICE-SPILLOVER",
        "CL-BOK16-DTI-PRICE-TIGHTEN"
      ],
      "related_cohort_ids": [
        "demo_cohort_one_home_mover",
        "demo_cohort_cash_rich"
      ],
      "spillover_from_region_codes": ["11680", "11710"]
    },
    {
      "region_code": "41290",
      "region_name": "경기 과천시",
      "price_change": {
        "low": 0.1,
        "median": 0.6,
        "high": 1.1,
        "ci80_low": -0.4,
        "ci80_high": 1.5,
        "unit": "percent_vs_demo_baseline"
      },
      "transaction_change": {
        "low": -2.0,
        "median": 2.1,
        "high": 5.5,
        "ci80_low": -4.5,
        "ci80_high": 7.8,
        "unit": "percent_vs_demo_baseline"
      },
      "mortgage_limit_change": {
        "low": -26.0,
        "median": -20.0,
        "high": -14.0,
        "ci80_low": -30.0,
        "ci80_high": -11.0,